{
    "$schema": "https://json-schema.org/draft/2020-12/schema",
    "$id": "https://agentmanifest.org/schema/manifest-0.1.0.json",
    "title": "Agent Manifest v0.1.0",
    "description": "A minimal, execution-agnostic declarative specification for AI agents to declare identity, purpose, constraints, autonomy, risk boundaries, and data handling before interaction.",
    "type": "object",
    "additionalProperties": true,
    "required": [
        "manifest_version",
        "agent_id",
        "agent_name",
        "agent_version",
        "owner",
        "purpose",
        "forbidden_actions",
        "autonomy",
        "risk_profile",
        "data_handling",
        "contact"
    ],
    "properties": {
        "manifest_version": {
            "type": "string",
            "const": "0.1.0",
            "description": "Version of the Agent Manifest specification. Must be exactly 0.1.0."
        },
        "agent_id": {
            "type": "string",
            "minLength": 3,
            "maxLength": 128,
            "pattern": "^[a-zA-Z0-9._-]+$",
            "description": "Stable, unambiguous identifier for the agent."
        },
        "agent_name": {
            "type": "string",
            "minLength": 1,
            "maxLength": 120,
            "description": "Human-readable name of the agent."
        },
        "agent_version": {
            "type": "string",
            "minLength": 1,
            "maxLength": 64,
            "description": "Agent version (not the manifest version)."
        },
        "owner": {
            "type": "object",
            "additionalProperties": true,
            "required": [
                "type",
                "identifier"
            ],
            "properties": {
                "type": {
                    "type": "string",
                    "enum": [
                        "individual",
                        "organization",
                        "system"
                    ],
                    "description": "Accountable owner type."
                },
                "identifier": {
                    "type": "string",
                    "minLength": 1,
                    "maxLength": 200,
                    "description": "Human-readable accountable reference."
                }
            },
            "description": "Ownership and accountability declaration."
        },
        "purpose": {
            "type": "object",
            "additionalProperties": true,
            "required": [
                "primary_code",
                "description"
            ],
            "properties": {
                "primary_code": {
                    "type": "string",
                    "minLength": 2,
                    "maxLength": 64,
                    "pattern": "^[a-z0-9._-]+$",
                    "description": "Primary purpose code (bounded and stable)."
                },
                "description": {
                    "type": "string",
                    "minLength": 10,
                    "maxLength": 1000,
                    "description": "Human-readable purpose description (specific and bounded)."
                }
            },
            "description": "Declared purpose."
        },
        "forbidden_actions": {
            "type": "array",
            "minItems": 1,
            "items": {
                "type": "string",
                "minLength": 2,
                "maxLength": 120
            },
            "description": "Hard constraints: explicit actions the agent must not perform."
        },
        "autonomy": {
            "type": "object",
            "additionalProperties": true,
            "required": [
                "level"
            ],
            "properties": {
                "level": {
                    "type": "integer",
                    "minimum": 0,
                    "maximum": 3,
                    "description": "Declared autonomy level (0â€“3)."
                }
            },
            "description": "Declared autonomy scope."
        },
        "risk_profile": {
            "type": "object",
            "additionalProperties": true,
            "required": [
                "level"
            ],
            "properties": {
                "level": {
                    "type": "string",
                    "enum": [
                        "low",
                        "medium",
                        "high"
                    ],
                    "description": "Self-declared risk boundary."
                },
                "notes": {
                    "type": "string",
                    "minLength": 1,
                    "maxLength": 1000,
                    "description": "Optional explanatory notes about risk assumptions."
                }
            },
            "description": "Declared risk profile."
        },
        "data_handling": {
            "type": "object",
            "additionalProperties": true,
            "required": [
                "stores_personal_data"
            ],
            "properties": {
                "stores_personal_data": {
                    "type": "boolean",
                    "description": "Whether the agent stores or persists personal data."
                },
                "retention": {
                    "type": "string",
                    "minLength": 1,
                    "maxLength": 120,
                    "description": "Optional retention policy label (e.g. 'none', 'temporary', '30d')."
                }
            },
            "description": "Data handling declaration."
        },
        "contact": {
            "type": "object",
            "additionalProperties": true,
            "required": [
                "email"
            ],
            "properties": {
                "email": {
                    "type": "string",
                    "format": "email",
                    "maxLength": 254,
                    "description": "Contact email for accountability and escalation."
                }
            },
            "description": "Contact information."
        },
        "language": {
            "type": "object",
            "additionalProperties": true,
            "properties": {
                "primary": {
                    "type": "string",
                    "minLength": 2,
                    "maxLength": 32,
                    "description": "Primary human-facing language tag."
                },
                "supported": {
                    "type": "array",
                    "minItems": 1,
                    "items": {
                        "type": "string",
                        "minLength": 2,
                        "maxLength": 32
                    },
                    "description": "Additional supported human-facing languages."
                }
            },
            "description": "Optional language declaration."
        }
    }
}
